{
  "brief_id": "SUNRISE-KIDS-TUYENSINH-2026-08",
  "source_angle_id": "A-01",
  "chan_dung": "PH1",
  "fanpage": {
    "noi_dung": "Bé nhà mình học tiếng Anh ở trường mấy năm rồi, gặp người nước ngoài vẫn đứng im, không dám mở miệng?\nKhông phải vì bé kém, mà vì cả buổi chỉ ngồi nghe, ít khi được nói.\n\nỞ Sunrise Kids, một buổi bảy mươi lăm phút bé được gọi lên nói ít nhất ba lượt. Trợ giảng người Việt theo sát cả buổi, để bé không ngại khi lỡ nói sai. Lớp tối đa mười lăm bé, một giáo viên bản ngữ đứng lớp.\n\nCuối mỗi tháng, anh chị nhận báo cáo riêng: con nói được gì rồi, còn vướng chỗ nào, cần luyện thêm phần nào ở nhà. Không biết tiếng Anh, anh chị vẫn theo dõi được con.\n\nBên mình không hứa hẹn thời gian tiến bộ cụ thể, chỉ mời bé học thử một buổi để anh chị tự thấy.\n\nKhoá mới sắp nhận đăng ký, ngày khai giảng: [cần bổ sung].\n\nNhắn tin cho page để đặt lịch học thử cho bé nhé.",
    "so_tu": 168,
    "hook": "Bé nhà mình học tiếng Anh ở trường mấy năm rồi, gặp người nước ngoài vẫn đứng im, không dám mở miệng? Không phải vì bé kém, mà vì cả buổi chỉ ngồi nghe, ít khi được nói.",
    "cta": "Nhắn tin cho page để đặt lịch học thử cho bé nhé."
  },
  "tiktok": {
    "tong_thoi_luong_giay": 45,
    "khoi": [
      {
        "ten_khoi": "HOOK",
        "thoi_gian": "0-3s",
        "hinh_anh": "Cận cảnh bàn tay bé lật cuốn tập tiếng Anh, chữ 'Sunrise Kids' hiện trên nền trắng phía sau, không quay mặt bé",
        "loi_thoai": "Con học tiếng Anh mấy năm rồi mà gặp người nước ngoài vẫn im re?"
      },
      {
        "ten_khoi": "PROBLEM",
        "thoi_gian": "3-10s",
        "hinh_anh": "Chữ chạy trên nền trắng liệt kê từng nỗi lo của phụ huynh, không quay mặt bé",
        "loi_thoai": "Không phải con dở đâu. Chỉ là cả buổi học con toàn ngồi nghe, ít khi được nói."
      },
      {
        "ten_khoi": "SOLUTION",
        "thoi_gian": "10-35s",
        "hinh_anh": "Toàn cảnh lớp học quay từ phía sau lưng các bé, trợ giảng đứng cạnh chỉ tay vào một bé đang nói, không lộ mặt trẻ em",
        "loi_thoai": "Ở Sunrise Kids, mỗi buổi bảy mươi lăm phút, con được gọi lên nói ít nhất ba lượt. Lớp mười lăm bé, một trợ giảng theo sát cả buổi."
      },
      {
        "ten_khoi": "CTA",
        "thoi_gian": "35-45s",
        "hinh_anh": "Chữ 'Nhắn tin đặt lịch học thử' hiện trên nền trắng, logo Sunrise Kids ở góc dưới",
        "loi_thoai": "Nhắn tin cho page để đặt lịch học thử cho con nhé."
      }
    ]
  },
  "thieu_thong_tin": [
    "Ngày khai giảng khoá mới — brief chưa có, đã hỏi trung tâm nhưng chưa phản hồi"
  ]
}
